{
  "schema_version": "arcanum.continuation_route.v1",
  "route_id": "route-repeated-fingerprint-block",
  "source": {"capability": "task-session", "mode": "execute", "result": "blocked", "receipt": "fixtures/source-repeat.json", "blocker_fingerprint": "sha256:unchanged-blocker-v1", "legacy_adaptation": false},
  "authorization": {"requested": false, "exact_route": null, "evidence": null},
  "candidates": [
    {
      "rank": 1,
      "capability": "task-session",
      "mode": "execute",
      "mutation_mode": null,
      "owner": "task-session",
      "evidence": ["A legacy follow-up repeats the source route without changed controlling evidence."],
      "required_inputs": ["changed controlling evidence"],
      "missing_inputs": ["changed controlling evidence"],
      "mutation_risk": "none",
      "approval_required": false,
      "authorization_status": "not-required",
      "expected_receipt": "Fresh Task Session receipt after evidence changes.",
      "fallback": "Use the existing terminal receipt to select a different owner route."
    }
  ],
  "selection": {"status": "blocked", "candidate_rank": 1, "reason": "The source capability, mode, target, and blocker fingerprint are unchanged."},
  "dispatch": {"status": "blocked", "runtime": null, "owner_receipt": null, "helper_closeout": "n/a"},
  "owner_boundary": "pass",
  "returned_next_route": null
}
