{
  "schema_version": "arcanum.continuation_route.v1",
  "route_id": "route-legacy-no-silent-approval",
  "source": {"capability": "task-session", "mode": "execute", "result": "blocked", "receipt": "fixtures/legacy-terminal-report.md", "blocker_fingerprint": "sha256:legacy-drift-v1", "legacy_adaptation": true},
  "authorization": {"requested": false, "exact_route": null, "evidence": null},
  "candidates": [
    {
      "rank": 1,
      "capability": "invoke",
      "mode": "refresh",
      "mutation_mode": "proposal-only",
      "owner": "invoke",
      "evidence": ["Legacy text says the planning package needs refresh."],
      "required_inputs": ["target inventory", "source evidence"],
      "missing_inputs": ["target inventory"],
      "mutation_risk": "low",
      "approval_required": false,
      "authorization_status": "not-required",
      "expected_receipt": "Proposal-only Invoke Refresh receipt.",
      "fallback": "Return the inferred route and request the missing target inventory."
    }
  ],
  "selection": {"status": "blocked", "candidate_rank": 1, "reason": "Legacy evidence is readable, but required structured owner input is missing."},
  "dispatch": {"status": "blocked", "runtime": null, "owner_receipt": null, "helper_closeout": "n/a"},
  "owner_boundary": "pass",
  "returned_next_route": null
}
